{
  "$schema": "./scripts/lib/se-core.config.schema.json",
  "comment": "Edit this file (or run scripts/configure.sh) after cloning. Replace placeholders with absolute paths and your details before invoking onboard-project.sh, sync-hooks.sh, or sync-to-template.sh.",

  "se_core_root": "__SE_CORE_PATH__",
  "projects_root": "__PROJECTS_ROOT__",
  "user_home": "__USER_HOME__",

  "maintainer_name": "__MAINTAINER_NAME__",
  "github_user": "__GITHUB_USER__",

  "harnesses": ["claude"],

  "template": {
    "remote": "git@github.com:__GITHUB_USER__/se-core-template.git",
    "branch": "main",
    "redact_paths": [
      "audits/",
      "blacklist.md",
      "registry.md"
    ]
  },

  "sed_flavor": "auto"
}
